id,ids,name,primary_artist,venue_name,city,state,country,url,window,local_date,start_datetime,date_start,date_end,multi_night,night_count,score,ai_priority,ai_reason
G5vYZbSL4oP_1,"['G5vYZbSL4oP_1', 'G5vYZbV6u6UTx']",TWICE [THIS IS FOR] WORLD TOUR IN OAKLAND,TWICE,Oakland Arena,Oakland,CA,US,https://www.ticketmaster.com/twice-this-is-for-world-tour-oakland-california-01-17-2026/event/1C006337D546564A,short_term,2026-01-17,2026-01-18T04:00:00+00:00,2026-01-18T04:00:00+00:00,2026-01-19T04:00:00+00:00,True,2,0.7089999999999999,10,"TWICE is a major K-pop act with a massive following, making their world tour stop in Oakland a highly anticipated event."
G5vYZbR9jwVdY,['G5vYZbR9jwVdY'],Ray Volpe,Ray Volpe,Bill Graham Civic Auditorium,San Francisco,CA,US,https://www.ticketmaster.com/ray-volpe-san-francisco-california-01-24-2026/event/1C0062F5DCCB40F0,short_term,2026-01-24,2026-01-25T03:30:00+00:00,2026-01-25T03:30:00+00:00,2026-01-25T03:30:00+00:00,False,1,0.6969999999999998,9,"Ray Volpe is gaining traction in the electronic scene, known for his energetic live shows."
G5vYZbSeS2N41,['G5vYZbSeS2N41'],GoldFord: Space of the Heart Tour,Goldford,The Fillmore,San Francisco,CA,US,https://www.ticketmaster.com/goldford-space-of-the-heart-tour-san-francisco-california-01-14-2026/event/1C006330B33E354A,short_term,2026-01-14,2026-01-15T04:00:00+00:00,2026-01-15T04:00:00+00:00,2026-01-15T04:00:00+00:00,False,1,0.694,9,GoldFord's 'Space of the Heart Tour' promises an engaging live experience with a unique sound.
G5vYZbwKhqIOS,['G5vYZbwKhqIOS'],MxPx,MxPx,The Fillmore,San Francisco,CA,US,https://www.ticketmaster.com/mxpx-san-francisco-california-01-24-2026/event/1C006324DB768833,short_term,2026-01-24,2026-01-25T04:00:00+00:00,2026-01-25T04:00:00+00:00,2026-01-25T04:00:00+00:00,False,1,0.694,8,"MxPx is a well-known band in the punk scene, appealing to nostalgia while still attracting new fans."
G5vYZbmX_bvik,['G5vYZbmX_bvik'],An Evening With Arooj Aftab,Arooj Aftab,Palace of Fine Arts,San Francisco,CA,US,https://www.ticketmaster.com/an-evening-with-arooj-aftab-san-francisco-california-01-23-2026/event/1C0062EF99601B06,short_term,2026-01-23,2026-01-24T04:30:00+00:00,2026-01-24T04:30:00+00:00,2026-01-24T04:30:00+00:00,False,1,0.6849999999999999,8,Arooj Aftab's unique sound and strong reputation for live performances make this a must-see show.
rZ7HnEZ1AfQKFS,['rZ7HnEZ1AfQKFS'],The Seshen & Rituals of Mine,The Seshen,The Independent,San Francisco,CA,US,https://www.ticketweb.com/event/the-seshen-rituals-of-the-independent-tickets/14693233,short_term,2026-01-16,2026-01-17T05:00:00+00:00,2026-01-17T05:00:00+00:00,2026-01-17T05:00:00+00:00,False,1,0.6789999999999999,8,The Seshen's blend of genres and strong live reputation make their show intriguing.
rZ7HnEZ1Af_YaK,['rZ7HnEZ1Af_YaK'],Lost Kings,Lost Kings,The Independent,San Francisco,CA,US,https://www.ticketweb.com/event/lost-kings-the-independent-tickets/14670253,short_term,2026-01-17,2026-01-18T05:00:00+00:00,2026-01-18T05:00:00+00:00,2026-01-18T05:00:00+00:00,False,1,0.6789999999999999,8,"Lost Kings are known for their engaging performances, making this show appealing to electronic music fans."
rZ7HnEZ1AfQvrd,['rZ7HnEZ1AfQvrd'],Earlybirds Club,Earlybirds Club,The Independent,San Francisco,CA,US,https://www.ticketweb.com/event/earlybirds-club-the-independent-tickets/14681783,short_term,2026-01-23,2026-01-24T02:00:00+00:00,2026-01-24T02:00:00+00:00,2026-01-24T02:00:00+00:00,False,1,0.6789999999999999,8,Earlybirds Club offers a fresh sound that resonates well with the indie scene.
G5vYZbmEaXVdH,['G5vYZbmEaXVdH'],JMSN,JMSN,August Hall,San Francisco,CA,US,https://www.ticketmaster.com/jmsn-san-francisco-california-01-24-2026/event/1C0062E9C9FB40FC,short_term,2026-01-24,2026-01-25T05:00:00+00:00,2026-01-25T05:00:00+00:00,2026-01-25T05:00:00+00:00,False,1,0.6789999999999999,8,JMSN's soulful sound and strong live presence make this a highly anticipated performance.
rZ7HnEZ1AfpbbN,['rZ7HnEZ1AfpbbN'],Austra,Austra,The Independent,San Francisco,CA,US,https://www.ticketweb.com/event/austra-the-independent-tickets/14598623,short_term,2026-01-24,2026-01-25T05:00:00+00:00,2026-01-25T05:00:00+00:00,2026-01-25T05:00:00+00:00,False,1,0.6789999999999999,8,Austra's unique blend of electronic and indie pop is sure to create a memorable live experience.
G5vYZbSBU1fh4,['G5vYZbSBU1fh4'],Say She She: Cut & Rewind Tour,Say She She,August Hall,San Francisco,CA,US,https://www.ticketmaster.com/say-she-she-cut-rewind-tour-san-francisco-california-01-27-2026/event/1C00633EB62946D5,short_term,2026-01-27,2026-01-28T04:00:00+00:00,2026-01-28T04:00:00+00:00,2026-01-28T04:00:00+00:00,False,1,0.6789999999999999,8,"Say She She's tour is generating buzz, promising an engaging live performance."
rZ7HnEZ1AKx3Q7,['rZ7HnEZ1AKx3Q7'],Yseult,Yseult,The Independent,San Francisco,CA,US,https://www.ticketweb.com/event/yseult-the-independent-tickets/13892684,short_term,2026-01-27,2026-01-28T04:00:00+00:00,2026-01-28T04:00:00+00:00,2026-01-28T04:00:00+00:00,False,1,0.6789999999999999,8,Yseult's rising popularity and unique sound make her performance a noteworthy event.
G5vYZbVI64XNR,['G5vYZbVI64XNR'],GLAIVE - Y'ALL TOUR,glaive,August Hall,San Francisco,CA,US,https://www.ticketmaster.com/glaive-yall-tour-san-francisco-california-01-28-2026/event/1C00634A0757E8EF,short_term,2026-01-28,2026-01-29T04:00:00+00:00,2026-01-29T04:00:00+00:00,2026-01-29T04:00:00+00:00,False,1,0.6789999999999999,8,"glaive's tour is attracting attention in the alt-pop scene, making this show exciting."
rZ7HnEZ1AKPpPf,['rZ7HnEZ1AKPpPf'],MØ,Mo,The Independent,San Francisco,CA,US,https://www.ticketweb.com/event/m-the-independent-tickets/13956954,short_term,2026-01-28,2026-01-29T04:00:00+00:00,2026-01-29T04:00:00+00:00,2026-01-29T04:00:00+00:00,False,1,0.6789999999999999,8,Mo's performance is anticipated due to her strong presence in the pop scene.
G5vYZbgfqCjqs,['G5vYZbgfqCjqs'],BAD OMENS - DO YOU FEEL LOVE NORTH AMERICAN TOUR,Bad Omens,Oakland Arena,Oakland,CA,US,https://www.ticketmaster.com/bad-omens-do-you-feel-love-oakland-california-03-27-2026/event/1C0063551D39C771,short_term,2026-03-27,2026-03-28T02:00:00+00:00,2026-03-28T02:00:00+00:00,2026-03-28T02:00:00+00:00,False,1,0.6789999999999999,8,"Bad Omens are gaining popularity in the rock scene, making their tour stop noteworthy."
G5vYZbUNJET7P,['G5vYZbUNJET7P'],JACKSON WANG - MAGICMAN 2 WORLD TOUR 2026-2027,Jackson Wang,Oakland Arena,Oakland,CA,US,https://www.ticketmaster.com/jackson-wang-magicman-2-world-tour-oakland-california-04-02-2026/event/1C006368E69FF125,short_term,2026-04-02,2026-04-03T03:00:00+00:00,2026-04-03T03:00:00+00:00,2026-04-03T03:00:00+00:00,False,1,0.6789999999999999,8,"Jackson Wang's world tour is highly anticipated, promising a vibrant live experience."
G5vYZbM5AyuIQ,['G5vYZbM5AyuIQ'],Van Morrison,Van Morrison,Palace of Fine Arts,San Francisco,CA,US,https://www.ticketmaster.com/van-morrison-san-francisco-california-02-18-2026/event/1C006372C5E4DA1A,short_term,2026-02-18,2026-02-19T03:00:00+00:00,2026-02-19T03:00:00+00:00,2026-02-19T03:00:00+00:00,False,1,0.655,7,Jason Isbell and the 400 Unit are known for their captivating live performances.
G5vYZbV58V6D_,['G5vYZbV58V6D_'],Magic City Hippies,Magic City Hippies,August Hall,San Francisco,CA,US,https://www.ticketmaster.com/magic-city-hippies-san-francisco-california-02-26-2026/event/1C006342D0D07ED9,short_term,2026-02-26,2026-02-27T04:30:00+00:00,2026-02-27T04:30:00+00:00,2026-02-27T04:30:00+00:00,False,1,0.649,7,"Atmosphere's tour is generating buzz in the hip-hop scene, making it a must-see event."
G5vYZbgIlPOwJ,['G5vYZbgIlPOwJ'],DAVE - The Boy Who Played the Harp Tour,Dave,Fox Theater - Oakland,Oakland,CA,US,https://www.ticketmaster.com/dave-the-boy-who-played-the-oakland-california-03-31-2026/event/1C00635A2B960CA6,short_term,2026-03-31,2026-04-01T03:00:00+00:00,2026-04-01T03:00:00+00:00,2026-04-01T03:00:00+00:00,False,1,0.6340000000000001,7,DAVE's tour is anticipated due to his rising popularity in the hip-hop genre.
