id,ids,name,primary_artist,venue_name,city,state,country,url,window,local_date,start_datetime,date_start,date_end,multi_night,night_count,score,ai_priority,ai_reason
G5vYZbVivluSD,['G5vYZbVivluSD'],Kelly Chen: Season 2 Live 2025,Kelly Chen,Chase Center,San Francisco,CA,US,https://www.ticketmaster.com/kelly-chen-season-2-live-2025-san-francisco-california-12-19-2025/event/1C00634B01ACDCFB,short_term,2025-12-19,2025-12-20T04:00:00+00:00,2025-12-20T04:00:00+00:00,2025-12-20T04:00:00+00:00,False,1,0.7149999999999999,8,"Kelly Chen's live shows are known for their high energy and emotional connection with fans, making this a highly anticipated event."
G5vYZbVDB7G0v,['G5vYZbVDB7G0v'],Live 105 Presents Not So Silent Night,Not So Silent Night,SAP Center at San Jose,San Jose,CA,US,https://www.ticketmaster.com/live-105-presents-not-so-silent-san-jose-california-12-14-2025/event/1C00634EFA10C901,short_term,2025-12-14,2025-12-15T03:00:00+00:00,2025-12-15T03:00:00+00:00,2025-12-15T03:00:00+00:00,False,1,0.7059999999999998,8,"Not So Silent Night features a lineup of popular alternative acts, promising a diverse and exciting night for fans."
G5vYZbm1Qa7N_,"['G5vYZbm1Qa7N_', 'G5vYZbm1Qa004']",KATSEYE: THE BEAUTIFUL CHAOS TOUR,KATSEYE,The Theater at Bill Graham Civic Auditorium,San Francisco,CA,US,https://www.ticketmaster.com/katseye-the-beautiful-chaos-tour-san-francisco-california-12-05-2025/event/1C0062E29A2448D9,short_term,2025-12-05,2025-12-06T04:00:00+00:00,2025-12-06T04:00:00+00:00,2025-12-07T04:00:00+00:00,True,2,0.6969999999999998,7,KATSEYE's Beautiful Chaos Tour is generating buzz for its unique blend of performance art and music.
G5vYZblczw8D7,['G5vYZblczw8D7'],Public Service Broadcasting North American Tour 2025,Public Service Broadcasting,The Fillmore,San Francisco,CA,US,https://www.ticketmaster.com/public-service-broadcasting-north-american-tour-san-francisco-california-12-03-2025/event/1C0062BB78C90EC4,short_term,2025-12-03,2025-12-04T04:00:00+00:00,2025-12-04T04:00:00+00:00,2025-12-04T04:00:00+00:00,False,1,0.694,7,"Public Service Broadcasting's innovative live shows combine music with visual storytelling, making for a captivating experience."
Z7r9jZ1A7bw4O,['Z7r9jZ1A7bw4O'],Motion City Soundtrack w/ Say Anything,Motion City Soundtrack,Warfield,San Francisco,CA,US,https://www.ticketmaster.com/event/Z7r9jZ1A7bw4O,short_term,2025-12-05,2025-12-06T03:30:00+00:00,2025-12-06T03:30:00+00:00,2025-12-06T03:30:00+00:00,False,1,0.694,7,"Motion City Soundtrack and Say Anything are both beloved bands with a strong following, promising a nostalgic night for fans."
G5vYZbnjKoke0,['G5vYZbnjKoke0'],The Mountain Goats,The Mountain Goats,The Fillmore,San Francisco,CA,US,https://www.ticketmaster.com/the-mountain-goats-san-francisco-california-12-10-2025/event/1C0062A7134460A4,short_term,2025-12-10,2025-12-11T04:00:00+00:00,2025-12-11T04:00:00+00:00,2025-12-11T04:00:00+00:00,False,1,0.694,7,"The Mountain Goats are known for their storytelling and intimate performances, making this a must-see show."
G5vYZbmnrw7y2,['G5vYZbmnrw7y2'],Couch: BIG TALK Tour,Couch,The Fillmore,San Francisco,CA,US,https://www.ticketmaster.com/couch-big-talk-tour-san-francisco-california-12-11-2025/event/1C0062EA9EC84E4F,short_term,2025-12-11,2025-12-12T04:00:00+00:00,2025-12-12T04:00:00+00:00,2025-12-12T04:00:00+00:00,False,1,0.694,7,Couch's BIG TALK Tour is attracting attention for its engaging live performances and relatable themes.
G5vYZbmT_d7hi,['G5vYZbmT_d7hi'],Waterparks: The Prowler Tour,Waterparks,The Fillmore,San Francisco,CA,US,https://www.ticketmaster.com/waterparks-the-prowler-tour-san-francisco-california-12-12-2025/event/1C0062EFD90C46EC,short_term,2025-12-12,2025-12-13T03:00:00+00:00,2025-12-13T03:00:00+00:00,2025-12-13T03:00:00+00:00,False,1,0.694,7,Waterparks' energetic performances and strong fan engagement make their Prowler Tour a highly anticipated event.
G5vYZbSDkTfza,['G5vYZbSDkTfza'],Alice 97.3's Alice in Winterland: Alex Warren and Rob Thomas ,Alex Warren,The Masonic,San Francisco,CA,US,https://www.ticketmaster.com/alice-973s-alice-in-winterland-alex-san-francisco-california-12-04-2025/event/1C00633EC6FD4E09,short_term,2025-12-04,2025-12-05T04:00:00+00:00,2025-12-05T04:00:00+00:00,2025-12-05T04:00:00+00:00,False,1,0.691,6,"Alice 97.3's Alice in Winterland features a mix of popular artists, creating a festive atmosphere for attendees."
G5vYZbnLnIVVV,['G5vYZbnLnIVVV'],Jorma Kaukonen's 85th Birthday,Jorma Kaukonen,The Masonic,San Francisco,CA,US,https://www.ticketmaster.com/jorma-kaukonens-85th-birthday-san-francisco-california-12-05-2025/event/1C0062A7EAA34D34,short_term,2025-12-05,2025-12-06T03:00:00+00:00,2025-12-06T03:00:00+00:00,2025-12-06T03:00:00+00:00,False,1,0.691,6,Jorma Kaukonen's 85th Birthday celebration is a unique opportunity to see a legendary musician perform live.
G5vYZbsR04Vll,['G5vYZbsR04Vll'],Pink Martini All-Stars present A Season of Stars,Pink Martini,The Masonic,San Francisco,CA,US,https://www.ticketmaster.com/pink-martini-allstars-present-a-season-san-francisco-california-12-06-2025/event/1C00631BE4574AEB,short_term,2025-12-06,2025-12-07T04:00:00+00:00,2025-12-07T04:00:00+00:00,2025-12-07T04:00:00+00:00,False,1,0.691,6,"Pink Martini's All-Stars show promises a lively and diverse musical experience, appealing to a wide audience."
Z7r9jZ1A7qevg,['Z7r9jZ1A7qevg'],Yuri,Yuri,San Jose Civic,San Jose,CA,US,https://www.ticketmaster.com/event/Z7r9jZ1A7qevg,short_term,2025-12-04,2025-12-05T04:30:00+00:00,2025-12-05T04:30:00+00:00,2025-12-05T04:30:00+00:00,False,1,0.691,6,"Yuri's performance is expected to draw a large crowd, showcasing her popularity in the Latin music scene."
G5vYZbm68CJc0,['G5vYZbm68CJc0'],"FLOW WORLD TOUR 2025 ""NARUTO THE ROCK""",FLOW,San Jose Civic,San Jose,CA,US,https://www.ticketmaster.com/flow-world-tour-2025-naruto-the-san-jose-california-12-05-2025/event/1C0062E1D03A6B64,short_term,2025-12-05,2025-12-06T05:00:00+00:00,2025-12-06T05:00:00+00:00,2025-12-06T05:00:00+00:00,False,1,0.691,6,"FLOW's WORLD TOUR is likely to attract anime and J-Pop fans, making it a unique concert experience."
G5vYZbRSLTk6V,['G5vYZbRSLTk6V'],NGHTMRE MINDFULL TOUR,Nghtmre,San Jose Civic,San Jose,CA,US,https://www.ticketmaster.com/nghtmre-mindfull-tour-san-jose-california-12-20-2025/event/1C0062FCDFFC61F4,short_term,2025-12-20,2025-12-21T04:00:00+00:00,2025-12-21T04:00:00+00:00,2025-12-21T04:00:00+00:00,False,1,0.691,6,"NGHTMRE's MINDFULL TOUR is generating buzz in the electronic music scene, promising an exciting night for fans."
G5vYZbslEafQt,['G5vYZbslEafQt'],KEYLAND UNCANNY VALLEY,Key,Paramount Theatre Oakland,Oakland,CA,US,https://www.ticketmaster.com/keyland-uncanny-valley-oakland-california-12-05-2025/event/1C00631AE72546A9,short_term,2025-12-05,2025-12-06T04:00:00+00:00,2025-12-06T04:00:00+00:00,2025-12-06T04:00:00+00:00,False,1,0.688,6,"KEYLAND's UNCANNY VALLEY show is expected to offer a unique musical experience, appealing to indie music fans."
G5vYZbw5DipJq,['G5vYZbw5DipJq'],An Acoustic Evening With Mike Campbell & The Dirty Knobs,Mike Campbell & The Dirty Knobs,Palace of Fine Arts,San Francisco,CA,US,https://www.ticketmaster.com/an-acoustic-evening-with-mike-campbell-san-francisco-california-12-09-2025/event/1C006322FBB1699D,short_term,2025-12-09,2025-12-10T04:00:00+00:00,2025-12-10T04:00:00+00:00,2025-12-10T04:00:00+00:00,False,1,0.6849999999999999,6,Mike Campbell & The Dirty Knobs' acoustic evening offers a chance to see a rock legend in an intimate setting.
Z7r9jZ1A7jkGA,['Z7r9jZ1A7jkGA'],Bouncing Souls w/ H2O,The Bouncing Souls,The UC Theatre,Berkeley,CA,US,https://www.ticketmaster.com/event/Z7r9jZ1A7jkGA,short_term,2025-12-11,2025-12-12T03:00:00+00:00,2025-12-12T03:00:00+00:00,2025-12-12T03:00:00+00:00,False,1,0.6819999999999999,6,"The Bouncing Souls and H2O are both influential bands in the punk scene, promising a high-energy show."
rZ7HnEZ1AK-f3f,['rZ7HnEZ1AK-f3f'],Anna of the North,Anna of the North,The Independent,San Francisco,CA,US,https://www.ticketweb.com/event/anna-of-the-north-the-independent-tickets/13854494,short_term,2025-12-03,2025-12-04T04:00:00+00:00,2025-12-04T04:00:00+00:00,2025-12-04T04:00:00+00:00,False,1,0.6789999999999999,6,Anna of the North's performance is highly anticipated due to her growing popularity in the indie pop scene.
rZ7HnEZ1AKOtfV,['rZ7HnEZ1AKOtfV'],Sydney Rose,Sydney Rose,The Independent,San Francisco,CA,US,https://www.ticketweb.com/event/sydney-rose-the-independent-tickets/13829534,short_term,2025-12-04,2025-12-05T04:00:00+00:00,2025-12-05T04:00:00+00:00,2025-12-05T04:00:00+00:00,False,1,0.6789999999999999,6,"Sydney Rose's show is gaining traction, appealing to fans of emerging indie artists."
