id,ids,name,primary_artist,venue_name,city,state,country,url,window,local_date,start_datetime,date_start,date_end,multi_night,night_count,score,ai_priority,ai_reason
G5vYZbVl6xQPM,['G5vYZbVl6xQPM'],LANY: Soft World Tour,LANY,Bill Graham Civic Auditorium,San Francisco,CA,US,https://www.ticketmaster.com/lany-soft-world-tour-san-francisco-california-04-03-2026/event/1C00634AC789A977,short_term,2026-04-03,2026-04-04T02:30:00+00:00,2026-04-04T02:30:00+00:00,2026-04-04T02:30:00+00:00,False,1,0.6969999999999998,10,"LANY has a strong reputation for their engaging live performances and emotional pop sound, making this show a must-see."
G5vYZ_ArR2roY,['G5vYZ_ArR2roY'],The Strokes,The Strokes,Bill Graham Civic Auditorium,San Francisco,CA,US,https://www.ticketmaster.com/the-strokes-san-francisco-california-04-06-2026/event/1C006457AF3DE470,short_term,2026-04-06,2026-04-07T02:30:00+00:00,2026-04-07T02:30:00+00:00,2026-04-07T02:30:00+00:00,False,1,0.6969999999999998,10,"The Strokes are iconic in the indie rock scene, and their live shows are known for high energy and nostalgia."
G5vYZbME8hBW0,['G5vYZbME8hBW0'],FKA twigs Body High Tour: A live show with FKA twigs w/ Special Guests,FKA twigs,Bill Graham Civic Auditorium,San Francisco,CA,US,https://www.ticketmaster.com/fka-twigs-body-high-tour-a-san-francisco-california-04-07-2026/event/1C006379D06FAF64,short_term,2026-04-07,2026-04-08T03:00:00+00:00,2026-04-08T03:00:00+00:00,2026-04-08T03:00:00+00:00,False,1,0.6969999999999998,10,"FKA twigs is celebrated for her innovative performances and unique sound, promising a captivating live experience."
G5vYZbgfqCjqs,['G5vYZbgfqCjqs'],BAD OMENS - DO YOU FEEL LOVE NORTH AMERICAN TOUR,Bad Omens,Oakland Arena,Oakland,CA,US,https://www.ticketmaster.com/bad-omens-do-you-feel-love-oakland-california-03-27-2026/event/1C0063551D39C771,short_term,2026-03-27,2026-03-28T02:00:00+00:00,2026-03-28T02:00:00+00:00,2026-03-28T02:00:00+00:00,False,1,0.7089999999999999,9,"Bad Omens is gaining traction in the alt scene, and their upcoming tour is generating significant buzz."
G5vYZbUNJET7P,['G5vYZbUNJET7P'],JACKSON WANG - MAGICMAN 2 WORLD TOUR 2026-2027,Jackson Wang,Oakland Arena,Oakland,CA,US,https://www.ticketmaster.com/jackson-wang-magicman-2-world-tour-oakland-california-04-02-2026/event/1C006368E69FF125,short_term,2026-04-02,2026-04-03T03:00:00+00:00,2026-04-03T03:00:00+00:00,2026-04-03T03:00:00+00:00,False,1,0.7089999999999999,9,"Jackson Wang's fusion of pop and performance art is drawing attention, making this a standout event."
G5vYZbVSJPtsw,['G5vYZbVSJPtsw'],Sticky Fingers - Live in North America,Sticky Fingers,The Masonic,San Francisco,CA,US,https://www.ticketmaster.com/sticky-fingers-live-in-north-america-san-francisco-california-04-06-2026/event/1C00634CE6969C72,short_term,2026-04-06,2026-04-07T03:00:00+00:00,2026-04-07T03:00:00+00:00,2026-04-07T03:00:00+00:00,False,1,0.691,8,"Sticky Fingers brings a unique blend of reggae and rock, promising a lively and fun concert experience."
G5vYZbMEntiC2,['G5vYZbMEntiC2'],Sarah Kinsley,Sarah Kinsley,August Hall,San Francisco,CA,US,https://www.ticketmaster.com/sarah-kinsley-san-francisco-california-03-30-2026/event/1C006379EAA6C38F,short_term,2026-03-30,2026-03-31T03:00:00+00:00,2026-03-31T03:00:00+00:00,2026-03-31T03:00:00+00:00,False,1,0.6789999999999999,8,"The Midnight is known for their nostalgic synth-pop sound and engaging live shows, appealing to a dedicated fanbase."
G5vYZbUfb4HBb,['G5vYZbUfb4HBb'],Goldie Boutilier,Goldie Boutilier,August Hall,San Francisco,CA,US,https://www.ticketmaster.com/goldie-boutilier-san-francisco-california-03-29-2026/event/1C0063651857CE98,short_term,2026-03-29,2026-03-30T03:00:00+00:00,2026-03-30T03:00:00+00:00,2026-03-30T03:00:00+00:00,False,1,0.6789999999999999,8,Calum Scott's heartfelt ballads and strong vocal performances make his shows emotionally resonant.
G5vYZ_7SSOu0W,['G5vYZ_7SSOu0W'],SPRINGSTEEN & E STREET Land of Hope & Dreams American Tour,Bruce Springsteen and The E Street Band,Chase Center,San Francisco,CA,US,https://www.ticketmaster.com/springsteen-e-street-land-of-hope-san-francisco-california-04-13-2026/event/1C00644CF380D93D,short_term,2026-04-13,2026-04-14T02:30:00+00:00,2026-04-14T02:30:00+00:00,2026-04-14T02:30:00+00:00,False,1,0.6849999999999999,7,Bruce Springsteen's legendary status and dynamic performances ensure a memorable concert experience.
G5vYZbM1VTjOx,['G5vYZbM1VTjOx'],THE EARLY NOVEMBER & HELLOGOODBYE: 20 Years Young,The Early November,August Hall,San Francisco,CA,US,https://www.ticketmaster.com/the-early-november-hellogoodbye-20-years-san-francisco-california-04-01-2026/event/1C006372B4FDC822,short_term,2026-04-01,2026-04-02T02:30:00+00:00,2026-04-02T02:30:00+00:00,2026-04-02T02:30:00+00:00,False,1,0.6789999999999999,7,"The Early November's nostalgic sound resonates with fans of early 2000s emo, making this a notable reunion show."
G5vYZbgIlPOwJ,['G5vYZbgIlPOwJ'],DAVE - The Boy Who Played the Harp Tour,Dave,Fox Theater - Oakland,Oakland,CA,US,https://www.ticketmaster.com/dave-the-boy-who-played-the-oakland-california-03-31-2026/event/1C00635A2B960CA6,short_term,2026-03-31,2026-04-01T03:00:00+00:00,2026-04-01T03:00:00+00:00,2026-04-01T03:00:00+00:00,False,1,0.664,7,Dave's unique storytelling and engaging stage presence make his performance a highly anticipated event.
G5vYZbMkzbD9R,['G5vYZbMkzbD9R'],Jeff Tweedy with special guest Sima Cunningham,Jeff Tweedy,Uptown Theatre Napa,Napa,CA,US,https://www.ticketmaster.com/jeff-tweedy-with-special-guest-sima-napa-california-03-27-2026/event/1C006371B863B5EF,short_term,2026-03-27,2026-03-28T02:30:00+00:00,2026-03-28T02:30:00+00:00,2026-03-28T02:30:00+00:00,False,1,0.6729999999999999,6,"Jeff Tweedy's solo performances are intimate and showcase his songwriting prowess, appealing to fans of indie folk."
G5vYZbzKjpc_B,['G5vYZbzKjpc_B'],Rhye,Rhye,August Hall,San Francisco,CA,US,https://www.ticketmaster.com/rhye-san-francisco-california-04-24-2026/event/1C006384DC5AD67A,short_term,2026-04-24,2026-04-25T03:00:00+00:00,2026-04-25T03:00:00+00:00,2026-04-25T03:00:00+00:00,False,1,0.649,6,Rhye's smooth sound and intimate performances create a captivating atmosphere for concertgoers.
G5vYZbgwznyjQ,"['G5vYZbgwznyjQ', 'G5vYZbgwzltj-']",Father John Misty 3/24,Father John Misty,The Castro Theatre,San Francisco,CA,US,https://www.ticketmaster.com/father-john-misty-324-san-francisco-california-03-24-2026/event/1C00635CB8AB971A,short_term,2026-03-24,2026-03-25T03:00:00+00:00,2026-03-25T03:00:00+00:00,2026-03-26T03:00:00+00:00,True,2,0.6399999999999999,6,"The Disco Biscuits are known for their unique blend of jam and electronic music, creating a lively concert experience."
G5vYZbVUIRzCg,['G5vYZbVUIRzCg'],LIVE 105 Presents: The Format 4/16,The Format,The Castro Theatre,San Francisco,CA,US,https://www.ticketmaster.com/live-105-presents-the-format-416-san-francisco-california-04-16-2026/event/1C00634DA8BF83B5,short_term,2026-04-16,2026-04-17T01:50:00+00:00,2026-04-17T01:50:00+00:00,2026-04-17T01:50:00+00:00,False,1,0.61,6,"The Format's return is generating excitement among fans of alternative rock, promising a nostalgic experience."
G5vYZbgQt_zw8,['G5vYZbgQt_zw8'],Hatsune Miku - EXPO 2026 North America,Hatsune Miku,San Jose Civic,San Jose,CA,US,https://www.ticketmaster.com/hatsune-miku-expo-2026-north-america-san-jose-california-04-22-2026/event/1C006356A9678C90,short_term,2026-04-22,2026-04-23T03:00:00+00:00,2026-04-23T03:00:00+00:00,2026-04-23T03:00:00+00:00,False,1,0.661,5,"Hatsune Miku's unique virtual performances attract a dedicated fanbase, making this a special event."
G5vYZbgO-MKvy,['G5vYZbgO-MKvy'],The Summer Set,The Summer Set,August Hall,San Francisco,CA,US,https://www.ticketmaster.com/the-summer-set-san-francisco-california-04-11-2026/event/1C00635821DD3079,short_term,2026-04-11,2026-04-12T03:00:00+00:00,2026-04-12T03:00:00+00:00,2026-04-12T03:00:00+00:00,False,1,0.649,5,Good Kid's rising popularity and engaging live shows make their performance a noteworthy event.
G5vYZ_eVlEzLj,['G5vYZ_eVlEzLj'],Unbroken Chain: A Celebration of the Life and Music of Phil Lesh,Grahame Lesh,The Fillmore,San Francisco,CA,US,https://www.ticketmaster.com/unbroken-chain-a-celebration-of-the-san-francisco-california-03-22-2026/event/1C00642D2B9F87DC,short_term,2026-03-22,2026-03-23T03:00:00+00:00,2026-03-23T03:00:00+00:00,2026-03-23T03:00:00+00:00,False,1,0.694,,
G5vYZbMvFoynR,['G5vYZbMvFoynR'],Jeff Tweedy with special guest Macie Stewart,Jeff Tweedy,The Fillmore,San Francisco,CA,US,https://www.ticketmaster.com/jeff-tweedy-with-special-guest-macie-san-francisco-california-03-25-2026/event/1C00637048479AAF,short_term,2026-03-25,2026-03-26T03:00:00+00:00,2026-03-26T03:00:00+00:00,2026-03-26T03:00:00+00:00,False,1,0.694,,
